{
  "format": "reciprocal-delegation-fanout/0.1",
  "fanout_id": "fanout-complete-handback-pass-001",
  "parent": {
    "delegation_id": "delegation-parent-complete",
    "role": "orchestrator",
    "aperture": "parent-aperture",
    "state": "handback",
    "write_scope": ["src/a", "src/b"],
    "no_touch": ["release"],
    "consequence_class": "routine_reversible",
    "max_unreviewed_actions": 3,
    "handback_event": "family receipt posted"
  },
  "fanout_authorization": {
    "allowed": true,
    "source_ref": "two bounded child workers plus one direct parent action permitted",
    "one_hop_only": true,
    "max_active_children": 2,
    "family_action_ceiling": 3,
    "parent_direct_action_reserve": 1,
    "parent_mutates_while_children_active": false
  },
  "children": [
    {
      "child_id": "child-a",
      "actor": {"role": "worker-a", "aperture": "child-complete-a"},
      "consequence_class": "routine_reversible",
      "mutates": true,
      "write_scope": ["src/a"],
      "no_touch": ["release"],
      "max_unreviewed_actions": 1,
      "actions_used": 1,
      "may_subdelegate": false,
      "authorization_ref": null,
      "state": "returned",
      "receipt_required": true,
      "receipt_ref": "receipt-child-a-001"
    },
    {
      "child_id": "child-b",
      "actor": {"role": "worker-b", "aperture": "child-complete-b"},
      "consequence_class": "routine_reversible",
      "mutates": true,
      "write_scope": ["src/b"],
      "no_touch": ["release"],
      "max_unreviewed_actions": 1,
      "actions_used": 1,
      "may_subdelegate": false,
      "authorization_ref": null,
      "state": "returned",
      "receipt_required": true,
      "receipt_ref": "receipt-child-b-001"
    }
  ],
  "revocation": {
    "parent_revocation_propagates": true,
    "children_must_stop_before_parent_handback": true
  },
  "handback": {
    "event": "family receipt posted",
    "status": "complete",
    "parent_direct_actions_used": 1,
    "aggregate_actions_used": 3,
    "child_receipt_refs": ["receipt-child-a-001", "receipt-child-b-001"]
  }
}
