{
  "format": "reciprocal-delegation-fanout/0.1",
  "fanout_id": "fanout-overlap-fail-001",
  "parent": {
    "delegation_id": "delegation-parent-shared-src",
    "role": "orchestrator",
    "aperture": "parent-aperture",
    "state": "active",
    "write_scope": ["src"],
    "no_touch": ["release"],
    "consequence_class": "routine_reversible",
    "max_unreviewed_actions": 2,
    "handback_event": "family receipt posted"
  },
  "fanout_authorization": {
    "allowed": true,
    "source_ref": "two child workers permitted only on non-overlapping mutation scopes",
    "one_hop_only": true,
    "max_active_children": 2,
    "family_action_ceiling": 2,
    "parent_direct_action_reserve": 0,
    "parent_mutates_while_children_active": false
  },
  "children": [
    {
      "child_id": "child-shared",
      "actor": {"role": "worker-a", "aperture": "child-overlap-a"},
      "consequence_class": "routine_reversible",
      "mutates": true,
      "write_scope": ["src/shared"],
      "no_touch": ["release"],
      "max_unreviewed_actions": 1,
      "actions_used": 0,
      "may_subdelegate": false,
      "authorization_ref": null,
      "state": "active",
      "receipt_required": true,
      "receipt_ref": null
    },
    {
      "child_id": "child-shared-subdir",
      "actor": {"role": "worker-b", "aperture": "child-overlap-b"},
      "consequence_class": "routine_reversible",
      "mutates": true,
      "write_scope": ["src/shared/subdir"],
      "no_touch": ["release"],
      "max_unreviewed_actions": 1,
      "actions_used": 0,
      "may_subdelegate": false,
      "authorization_ref": null,
      "state": "active",
      "receipt_required": true,
      "receipt_ref": null
    }
  ],
  "revocation": {
    "parent_revocation_propagates": true,
    "children_must_stop_before_parent_handback": true
  },
  "handback": {
    "event": "family receipt posted",
    "status": "pending",
    "parent_direct_actions_used": 0,
    "aggregate_actions_used": 0,
    "child_receipt_refs": []
  }
}
